{"application":{"acceptance_vectors":[{"request":[104,195,169],"response":[65,99,99,101,112,116,101,100,58,32,104,195,169]},{"request":[255],"response":[105,110,118,97,108,105,100]},{"request":[],"response":[105,110,118,97,108,105,100]},{"request":[97,97,97,97,97,97,97,97,97,97,97,97,97,97,97,97,97,97,97,97,97,97,97,97,97,97,97,97,97,97,97,97,97,97,97,97,97,97,97,97,97,97,97,97,97,97,97,97,97,97,97,97,97,97,97,97,97,97,97,97,97,97,97,97],"response":[65,99,99,101,112,116,101,100,58,32,97,97,97,97,97,97,97,97,97,97,97,97,97,97,97,97,97,97,97,97,97,97,97,97,97,97,97,97,97,97,97,97,97,97,97,97,97,97,97,97,97,97,97,97,97,97,97,97,97,97,97,97,97,97,97,97,97,97,97,97,97,97,97,97]},{"request":[97,97,97,97,97,97,97,97,97,97,97,97,97,97,97,97,97,97,97,97,97,97,97,97,97,97,97,97,97,97,97,97,97,97,97,97,97,97,97,97,97,97,97,97,97,97,97,97,97,97,97,97,97,97,97,97,97,97,97,97,97,97,97,97,97],"response":[105,110,118,97,108,105,100]},{"request":[97,97,97,97,97,97,97,97,97,97,97,97,97,97,97,97,97,97,97,97,97,97,97,97,97,97,97,97,97,97,97,97,97,97,97,97,97,97,97,97,97,97,97,97,97,97,97,97,97,97,97,97,97,97,97,97,97,97,97,97,97,97,97,97,97,97,97,97,97,97,97,97,97,97,97,97,97,97,97,97,97,97,97,97,97,97,97,97,97,97,97,97,97,97,97,97,97,97,97,97,97,97,97,97,97,97,97,97,97,97,97,97,97,97,97,97,97,97,97,97,97,97,97,97,97,97,97,97],"response":[105,110,118,97,108,105,100]}],"capabilities_empty":true,"cargo_description":"A modeled byte-request conformance fixture.","cargo_homepage":"https://github.com/UOR-Foundation/PrismPM","cargo_name":"prism-text-request","cargo_repository":"https://github.com/UOR-Foundation/PrismPM","cargo_version":"0.1.0","core_contract":"hologram:guest/core-wasm@1","entry_root":"PrismTextRequest.TextRequest.dispatch","fat_archive":true,"guest_allocation_maximum":128,"library_roots":["PrismTextRequest.TextRequest.dispatch"],"name":"Text Request","primary_layer":0,"profile":"prismpm/text-application/1","request_maximum":64,"response_maximum":256,"view":{"heading":"Text request","input_error":"Invalid request","input_label":"Request","output_label":"Response","response_error":"Invalid response","submit_label":"Submit","title":"Text request — UTF-8"},"view_layer":1},"architecture":{"component_kinds":[],"components":[],"concerns":[],"edge_kinds":[],"edges":[],"model_kinds":[],"stakeholders":[],"viewpoints":[],"views":[]},"provenance":{"compiler_semantics_id":"0000000000000000000000000000000000000000000000000000000000000000","emitter_semantics_id":"0000000000000000000000000000000000000000000000000000000000000000","facet_packages":[],"semantic_id":"0000000000000000000000000000000000000000000000000000000000000000","snapshot_id":"0000000000000000000000000000000000000000000000000000000000000000","source_id":"0000000000000000000000000000000000000000000000000000000000000000"},"quality":{"characteristics":[],"measures":[],"requirements":[],"subcharacteristics":[]},"schema":"prismpm/model-document/2","security":{"activities":[],"assets":[],"controls":[],"impacts":[],"likelihoods":[],"measurements":[],"risks":[],"threats":[]},"standards_profile":[]}
